{
  "language": "en",
  "units": "metric",
  "voiceGuidelines": "",
  "goalWkg": 4.3,
  "openDays": [
    "Mon",
    "Tue",
    "Wed",
    "Thu",
    "Fri",
    "Sat",
    "Sun"
  ],
  "usualDurationMin": 60,
  "targetedSessionCap": 2,
  "gymDefault": "strength+core",
  "powerProfileOverride": null,
  "exportFormat": "zwo+intervals",
  "intervalsAthleteId": "i000000",
  "publishToIntervals": "ask",
  "level": "advanced",
  "eventType": "time-trial",
  "eventDate": null,
  "thresholdPaceSecPerKm": 235,
  "lthr": 178,
  "maxHr": null,
  "weeklyKm": 40,
  "trainingState": null,
  "constraints": [],
  "name": "Robin",
  "sport": "both",
  "objective": "Podium at regional duathlons and hold 4.2 W/kg",
  "age": 29,
  "gender": "other",
  "weightKg": 68,
  "baselineFtp": 290,
  "socialDays": [],
  "trainingAgeYears": 8,
  "weeklyHours": 12
}
