{
  "language": "en",
  "units": "metric",
  "voiceGuidelines": "",
  "goalWkg": null,
  "openDays": [
    "Mon",
    "Tue",
    "Wed",
    "Thu",
    "Fri",
    "Sat",
    "Sun"
  ],
  "usualDurationMin": 60,
  "targetedSessionCap": 2,
  "gymDefault": "strength+core",
  "powerProfileOverride": null,
  "exportFormat": "zwo",
  "intervalsAthleteId": null,
  "publishToIntervals": "ask",
  "level": "intermediate",
  "eventType": "marathon",
  "eventDate": "2027-04-11",
  "thresholdPaceSecPerKm": 270,
  "lthr": 168,
  "maxHr": null,
  "weeklyKm": 66,
  "trainingState": null,
  "constraints": [],
  "name": "Sam",
  "sport": "running",
  "objective": "Run a marathon under 3:30",
  "age": 41,
  "gender": "male",
  "weightKg": 70,
  "baselineFtp": null,
  "socialDays": [],
  "trainingAgeYears": 5,
  "weeklyHours": 7
}
